[
  {
    "touchpoint": "Touchpoint1",
    "conversion_rate": 6.35,
    "campaign_cost": 100,
    "sellers cost": 25.00,
    "sellers_cost_updates": 2.50
  },
  {
    "touchpoint": "Touchpoint2",
    "conversion_rate": 6.35,
    "campaign_cost": 100,
    "sellers cost": 25.00,
    "sellers_cost_updates": 2.50
  },
  {
    "touchpoint": "Touchpoint3",
    "conversion_rate": 6.35,
    "campaign_cost": 100,
    "sellers cost": 25.00,
    "sellers_cost_updates": 2.50
  },
  {
    "touchpoint": "Touchpoint4",
    "conversion_rate": 6.35,
    "campaign_cost": 100,
    "sellers cost": 25.00,
    "sellers_cost_updates": 2.50
  },
  {
    "touchpoint": "Touchpoint5",
    "conversion_rate": 6.35,
    "campaign_cost": 100,
    "sellers cost": 25.00,
    "sellers_cost_updates": 2.50
  },
  {
    "touchpoint": "Touchpoint6",
    "conversion_rate": 6.35,
    "campaign_cost": 100,
    "sellers cost": 25.00,
    "sellers_cost_updates": 2.50
  },
  {
    "touchpoint": "Touchpoint7",
    "conversion_rate": 6.35,
    "campaign_cost": 100,
    "sellers cost": 25.00,
    "sellers_cost_updates": 2.50
  }
]
